{
  "$schema": "../../schemas/v2/domain.schema.json",
  "schemaVersion": 2,
  "kind": "domain",
  "id": "DOMAIN-FIN",
  "title": "재정",
  "revision": 1,
  "status": "approved",
  "supersedes": null,
  "changeSummary": "현재 와이어프레임 화면을 최우선으로 재대조한 최초 R1 후보: 구매 요청 제출·조회·검토 공통 규칙",
  "approval": {
    "approvedBy": "제품 책임자",
    "approvedAt": "2026-08-03T16:04:45+09:00"
  },
  "sourceEvidence": [
    {
      "id": "SRC-001",
      "title": "현재 구매 요청 화면 구현",
      "kind": "repository_file",
      "authority": "current_wireframe_screen",
      "approvalState": "current",
      "conflictsWith": ["SRC-004"],
      "locator": {
        "kind": "repository_path",
        "value": "C:/Users/82108/Downloads/VADA-wireframe/src/app/App.tsx"
      },
      "observedAt": "2026-08-03T15:55:17+09:00",
      "sourceVersion": {
        "kind": "content_digest",
        "value": "sha256:7E541F87C7F4D92505A80AB3E43E534775CED204C1DB64E6DA44647E1EF7CE96"
      },
      "note": "FIN-REQ-01B·MY-REQ-01·FIN-REQ-02와 실제 권한 함수를 정적 대조했습니다."
    },
    {
      "id": "SRC-002",
      "title": "VADA 권한 매트릭스",
      "kind": "repository_file",
      "authority": "wireframe_internal_document",
      "approvalState": "current",
      "conflictsWith": ["SRC-004"],
      "locator": {
        "kind": "repository_path",
        "value": "C:/Users/82108/Downloads/VADA-wireframe/docs/VADA_PERMISSION_MATRIX.md"
      },
      "observedAt": "2026-08-03T15:55:17+09:00",
      "sourceVersion": {
        "kind": "content_digest",
        "value": "sha256:866A7F453F19E84724D83D1B61366BF80A9BF0E4AB93A47D3D2EB4DC86D8A85C"
      },
      "note": "구매 요청 제출은 부서장·재정부, 상세 읽기는 모든 구성원, 검토는 재정부로 정의합니다."
    },
    {
      "id": "SRC-003",
      "title": "VADA 재정 명세",
      "kind": "repository_file",
      "authority": "wireframe_internal_document",
      "approvalState": "current",
      "conflictsWith": ["SRC-007"],
      "locator": {
        "kind": "repository_path",
        "value": "C:/Users/82108/Downloads/VADA-wireframe/docs/VADA_FINANCE_SPEC.md"
      },
      "observedAt": "2026-08-03T15:55:17+09:00",
      "sourceVersion": {
        "kind": "content_digest",
        "value": "sha256:4516F54738AAEF3096E01EAF64C665E2F4D4B864682F0DCBA90535A19139423A"
      },
      "note": "요청·품목 모델과 검토·예산·감사 이력의 공통 규칙을 제공합니다. 감사보고서 구현 금지는 후속 직접 결정과 충돌합니다."
    },
    {
      "id": "SRC-004",
      "title": "구매 요청 접근 권한 기획 작업",
      "kind": "notion_page",
      "authority": "notion_document",
      "approvalState": "historical",
      "conflictsWith": ["SRC-001", "SRC-002", "SRC-005"],
      "locator": {
        "kind": "uri",
        "value": "https://app.notion.com/p/3ab68a85148e81fab11de0a36bf2a0e7"
      },
      "observedAt": "2026-08-03T00:40:43+09:00",
      "sourceVersion": {
        "kind": "last_edited_at",
        "value": "2026-07-31T02:20:10.763Z"
      },
      "note": "부서장만 제출한다고 기록한 과거 작업입니다. 현재 화면·권한 매트릭스·기획 담당자 확인으로 대체됐습니다."
    },
    {
      "id": "SRC-005",
      "title": "구매 요청 제출 권한에 대한 기획 담당자 최신 확인",
      "kind": "conversation",
      "authority": "direct_decision",
      "approvalState": "approved",
      "conflictsWith": ["SRC-004"],
      "locator": {
        "kind": "conversation_ref",
        "value": "current-thread/vada-finance-submitters-planner-confirmation-2026-08-03"
      },
      "observedAt": "2026-08-03T15:00:00+09:00",
      "sourceVersion": null,
      "note": "부서장뿐 아니라 재정부 구성원도 구매 요청을 제출할 수 있다고 직접 확인했습니다."
    },
    {
      "id": "SRC-006",
      "title": "재정 자료 우선순위에 대한 제품 책임자 결정",
      "kind": "conversation",
      "authority": "direct_decision",
      "approvalState": "approved",
      "conflictsWith": [],
      "locator": {
        "kind": "conversation_ref",
        "value": "current-thread/vada-finance-source-precedence-2026-08-03"
      },
      "observedAt": "2026-08-03T15:00:00+09:00",
      "sourceVersion": null,
      "note": "현재 화면, 와이어프레임 내부 문서, Notion, 기타 순으로 대조하되 최신 직접 결정이 우선한다고 확정했습니다."
    },
    {
      "id": "SRC-007",
      "title": "감사보고서 초안 생성 방식에 대한 제품 책임자 결정",
      "kind": "conversation",
      "authority": "direct_decision",
      "approvalState": "approved",
      "conflictsWith": ["SRC-003"],
      "locator": {
        "kind": "conversation_ref",
        "value": "current-thread/vada-finance-audit-draft-trigger"
      },
      "observedAt": "2026-08-03T14:34:15+09:00",
      "sourceVersion": null,
      "note": "재정부 사용자의 명시적 생성 요청과 학교별 양식 업로드를 조건으로 누적 기록에서 초안을 생성합니다."
    }
  ],
  "spec": {
    "purpose": {
      "id": "PURPOSE-001",
      "text": "학생회 구성원이 행사 예산 사용을 요청하고 재정부가 검토할 수 있도록 구매 요청의 공통 행위자·개념·권한·불변 규칙을 정의합니다.",
      "origin": {
        "kind": "source_extracted",
        "sourceRefs": ["SRC-001", "SRC-002", "SRC-003"],
        "itemRefs": []
      }
    },
    "boundaries": {
      "inScope": [
        {
          "id": "BOUNDARY-IN-001",
          "text": "행사 구매 요청의 작성·제출·본인 목록·상세 조회와 품목별 재정부 검토에 공통으로 적용되는 제품 규칙",
          "origin": {
            "kind": "source_extracted",
            "sourceRefs": ["SRC-001", "SRC-002", "SRC-003"],
            "itemRefs": []
          }
        }
      ],
      "outOfScope": [
        {
          "id": "BOUNDARY-OUT-001",
          "text": "구매 실행·증빙·실제 지출·감사보고서 초안 생성의 상세 흐름은 후속 플로우에서 정의합니다. 감사보고서 초안은 재정부의 명시적 실행과 학교별 양식 업로드가 필요하다는 결정은 보존합니다.",
          "origin": {
            "kind": "owner_stated",
            "sourceRefs": ["SRC-007"],
            "itemRefs": []
          }
        }
      ]
    },
    "actors": [
      {
        "id": "ACTOR-GENERAL-MEMBER",
        "name": "일반 구성원",
        "description": "구매 요청 상세와 허용된 재정 현황을 읽을 수 있지만 구매 요청 작성·검토 동작은 수행하지 않는 구성원",
        "origin": {
          "kind": "source_extracted",
          "sourceRefs": ["SRC-001", "SRC-002"],
          "itemRefs": []
        }
      },
      {
        "id": "ACTOR-DEPARTMENT-HEAD",
        "name": "부서장",
        "description": "소속 부서의 행사 구매 요청을 작성·제출하고 자신이 제출한 요청을 다시 확인하는 구성원",
        "origin": {
          "kind": "source_extracted",
          "sourceRefs": ["SRC-001", "SRC-002", "SRC-005"],
          "itemRefs": []
        }
      },
      {
        "id": "ACTOR-FINANCE-MEMBER",
        "name": "재정부 구성원",
        "description": "구매 요청을 작성·제출할 수 있고 해당 학생회의 구매 요청을 품목별로 검토하는 구성원",
        "origin": {
          "kind": "source_extracted",
          "sourceRefs": ["SRC-001", "SRC-002", "SRC-005"],
          "itemRefs": []
        }
      }
    ],
    "concepts": [
      {
        "id": "CONCEPT-PURCHASE-REQUEST",
        "name": "구매 요청",
        "definition": "한 행사에서 필요한 하나 이상의 구매 품목을 요청자·목적·필요일과 함께 제출하는 묶음",
        "origin": {
          "kind": "source_extracted",
          "sourceRefs": ["SRC-001", "SRC-003"],
          "itemRefs": []
        }
      },
      {
        "id": "CONCEPT-PURCHASE-ITEM",
        "name": "구매 품목",
        "definition": "구매 요청 안에서 금액을 계산하고 독립적으로 검토 결과를 가질 수 있는 단위",
        "origin": {
          "kind": "source_extracted",
          "sourceRefs": ["SRC-001", "SRC-003"],
          "itemRefs": []
        }
      }
    ],
    "authorization": {
      "defaultPolicy": "deny_unlisted",
      "capabilities": [
        {
          "id": "CAPABILITY-PURCHASE-REQUEST-CREATE",
          "name": "구매 요청 작성·제출",
          "description": "행사에 연결된 구매 요청을 작성하고 검토 대기 상태로 제출합니다.",
          "grantedActorRefs": ["ACTOR-DEPARTMENT-HEAD", "ACTOR-FINANCE-MEMBER"],
          "ruleRefs": ["DOMAIN-RULE-PURCHASE-REQUEST-CREATE"],
          "origin": {
            "kind": "source_extracted",
            "sourceRefs": ["SRC-001", "SRC-002", "SRC-005"],
            "itemRefs": []
          }
        },
        {
          "id": "CAPABILITY-PURCHASE-REQUEST-OWN-LIST",
          "name": "내 구매 요청 목록 조회",
          "description": "현재 행사에서 자신이 제출한 구매 요청과 처리 상태를 목록으로 확인합니다.",
          "grantedActorRefs": ["ACTOR-DEPARTMENT-HEAD", "ACTOR-FINANCE-MEMBER"],
          "ruleRefs": ["DOMAIN-RULE-PURCHASE-REQUEST-OWN-LIST"],
          "origin": {
            "kind": "source_extracted",
            "sourceRefs": ["SRC-001"],
            "itemRefs": []
          }
        },
        {
          "id": "CAPABILITY-PURCHASE-REQUEST-DETAIL-VIEW",
          "name": "구매 요청 상세 조회",
          "description": "학생회 구성원이 구매 요청의 내용과 진행 상태를 읽습니다.",
          "grantedActorRefs": ["ACTOR-GENERAL-MEMBER", "ACTOR-DEPARTMENT-HEAD", "ACTOR-FINANCE-MEMBER"],
          "ruleRefs": ["DOMAIN-RULE-PURCHASE-REQUEST-DETAIL-VIEW"],
          "origin": {
            "kind": "source_extracted",
            "sourceRefs": ["SRC-001", "SRC-002"],
            "itemRefs": []
          }
        },
        {
          "id": "CAPABILITY-PURCHASE-REQUEST-REVIEW",
          "name": "구매 요청 검토",
          "description": "구매 품목별 승인·보완 요청·반려 결과를 기록합니다.",
          "grantedActorRefs": ["ACTOR-FINANCE-MEMBER"],
          "ruleRefs": ["DOMAIN-RULE-PURCHASE-REQUEST-REVIEW"],
          "origin": {
            "kind": "source_extracted",
            "sourceRefs": ["SRC-002", "SRC-003"],
            "itemRefs": []
          }
        }
      ]
    },
    "rules": [
      {
        "id": "DOMAIN-RULE-PURCHASE-REQUEST-CREATE",
        "category": "authorization",
        "text": "부서장과 재정부 구성원만 구매 요청을 작성·제출할 수 있고 일반 구성원에게는 작성 동작을 제공하지 않습니다.",
        "origin": {
          "kind": "source_extracted",
          "sourceRefs": ["SRC-001", "SRC-002", "SRC-005"],
          "itemRefs": []
        }
      },
      {
        "id": "DOMAIN-RULE-PURCHASE-REQUEST-OWN-LIST",
        "category": "visibility",
        "text": "내 구매 요청 목록에는 현재 행사에서 현재 사용자가 제출한 요청만 표시합니다.",
        "origin": {
          "kind": "source_extracted",
          "sourceRefs": ["SRC-001"],
          "itemRefs": []
        }
      },
      {
        "id": "DOMAIN-RULE-PURCHASE-REQUEST-DETAIL-VIEW",
        "category": "visibility",
        "text": "구매 요청 상세 내용과 진행 상태는 학생회 모든 구성원이 읽을 수 있으며 변경 동작의 권한은 별도로 제한합니다.",
        "origin": {
          "kind": "source_extracted",
          "sourceRefs": ["SRC-001", "SRC-002"],
          "itemRefs": []
        }
      },
      {